{
  "$schema": "../../schema/harrys-room-record.schema.json",
  "record_id": "HLR-26.0028",
  "artifact_id": "26.0028",
  "legacy_ids": [],
  "title": "2000 ABA Third-Place Plaque",
  "alternate_titles": [],
  "slug": "26-0028-2000-aba-third-place-vet-pro-plaque",
  "collection": "Harry’s Room — The Harry Leary Collection",
  "room_zone": {
    "id": "trophy-case",
    "label": "The Trophy Case"
  },
  "record_type": "plaque",
  "holding_status": "current-holding-as-presented",
  "image_status": "direct",
  "primary_image": "../../source/artifact-images/26-0028-2000-aba-third-place-vet-pro-plaque.png",
  "secondary_images": [],
  "source_pages": [
    {
      "source_label": "Original LititzBMX.com collection source 1",
      "url": "https://sites.google.com/view/lititzbmxinventorylist/collections/the-harry-leary-collection-1"
    }
  ],
  "claim_status": "inscription-supported",
  "description": "An ABA plaque identifying Harry Leary as National #3 Vet Pro for 2000. The record connects the room’s championship history to the turn of the millennium.",
  "provenance_summary": "Presented as part of the Harry Leary Collection; acquisition detail was not supplied in this source package.",
  "qualifications": [
    "The recipient, class and 2000 result are visible in the supplied photograph."
  ],
  "people": [
    "Harry Leary"
  ],
  "organizations": [
    "American Bicycle Association (ABA)"
  ],
  "subjects": [
    "2000",
    "Vet Pro",
    "National number three",
    "plaque"
  ],
  "related_records": [
    "26.0067",
    "26.0037",
    "26.0013"
  ],
  "cross_collection": null,
  "release_version": "1.0.0",
  "updated": "2026-07-23"
}
