{
  "$schema": "../../schema/harrys-room-record.schema.json",
  "record_id": "HLR-26.0062",
  "artifact_id": "26.0062",
  "legacy_ids": [],
  "title": "Harry Leary “Harry” DIRTWERX Helmet",
  "alternate_titles": [],
  "slug": "26-0062-harry-leary-dirtwerx-helmet",
  "collection": "Harry’s Room — The Harry Leary Collection",
  "room_zone": {
    "id": "riders-wardrobe",
    "label": "The Rider’s Wardrobe"
  },
  "record_type": "helmet",
  "holding_status": "current-holding-as-presented",
  "image_status": "direct",
  "primary_image": "../../source/artifact-images/26-0062-harry-leary-dirtwerx-helmet.png",
  "secondary_images": [],
  "source_pages": [
    {
      "source_label": "Original LititzBMX.com collection source 2",
      "url": "https://sites.google.com/view/lititzbmxinventorylist/collections/the-harry-leary-collection-1/harry-leary-collection-2"
    }
  ],
  "claim_status": "collection-attributed",
  "description": "A black, yellow, silver and white full-face helmet marked “HARRY” and connected by the collection to Harry Leary’s DIRTWERX-era material record.",
  "provenance_summary": "Presented as part of the Harry Leary Collection; acquisition detail was not supplied in this source package.",
  "qualifications": [
    "The helmet markings are visible in the source image.",
    "The DIRTWERX and rider attribution are preserved from the supplied collection description."
  ],
  "people": [
    "Harry Leary"
  ],
  "organizations": [
    "DIRTWERX"
  ],
  "subjects": [
    "helmet",
    "DIRTWERX",
    "personal gear"
  ],
  "related_records": [
    "26.0063",
    "26.0036",
    "26.0030"
  ],
  "cross_collection": null,
  "release_version": "1.0.0",
  "updated": "2026-07-23"
}
