{
  "$schema": "../../schema/harrys-room-record.schema.json",
  "record_id": "HLR-26.0067",
  "artifact_id": "26.0067",
  "legacy_ids": [
    "67"
  ],
  "title": "1994 ABA Vet Pro Title Trophy",
  "alternate_titles": [],
  "slug": "26-0067-1994-aba-vet-pro-title-trophy",
  "collection": "Harry’s Room — The Harry Leary Collection",
  "room_zone": {
    "id": "trophy-case",
    "label": "The Trophy Case"
  },
  "record_type": "trophy",
  "holding_status": "current-holding-as-presented",
  "image_status": "direct",
  "primary_image": "../../source/artifact-images/26-0067-1994-aba-vet-pro-title-trophy.png",
  "secondary_images": [],
  "source_pages": [
    {
      "source_label": "Original LititzBMX.com collection source 1",
      "url": "https://sites.google.com/view/lititzbmxinventorylist/collections/the-harry-leary-collection-1"
    }
  ],
  "claim_status": "collection-attributed",
  "description": "A large trophy attributed by the collection to Harry Leary’s 1994 ABA Vet Pro title. It anchors the room’s championship case and represents a major later-career achievement.",
  "provenance_summary": "Presented as part of the Harry Leary Collection; acquisition detail was not supplied in this source package.",
  "qualifications": [
    "The canonical archive identifier is normalized as 26.0067; the Google Sites source displayed the legacy identifier “67”.",
    "The title and winner attribution come from the supplied collection description; the low-contrast inscription is not fully legible in the source photograph."
  ],
  "people": [
    "Harry Leary"
  ],
  "organizations": [
    "American Bicycle Association (ABA)"
  ],
  "subjects": [
    "1994",
    "Vet Pro",
    "championship",
    "trophy"
  ],
  "related_records": [
    "26.0037",
    "26.0028",
    "26.0033"
  ],
  "cross_collection": null,
  "release_version": "1.0.0",
  "updated": "2026-07-23"
}
