{
  "$schema": "../../schema/harrys-room-record.schema.json",
  "record_id": "HLR-26.0052",
  "artifact_id": "26.0052",
  "legacy_ids": [],
  "title": "Damaged Daylight HLT4 Frame — The Last HLT4",
  "alternate_titles": [],
  "slug": "26-0052-damaged-daylight-hlt4-frame-last-hlt4",
  "collection": "Harry’s Room — The Harry Leary Collection",
  "room_zone": {
    "id": "workshop-bench",
    "label": "The Workshop Bench"
  },
  "record_type": "bicycle frame",
  "holding_status": "current-holding-as-presented",
  "image_status": "direct",
  "primary_image": "../../source/artifact-images/26-0052-damaged-daylight-hlt4-frame-last-hlt4.png",
  "secondary_images": [],
  "source_pages": [
    {
      "source_label": "Original LititzBMX.com collection source 2",
      "url": "https://sites.google.com/view/lititzbmxinventorylist/collections/the-harry-leary-collection-1/harry-leary-collection-2"
    }
  ],
  "claim_status": "collection-attributed",
  "description": "A damaged metallic green Daylight frame marked “HL TURBO 4,” presented by the collection as the last HLT4. Its damaged state is part of the preserved record rather than something concealed.",
  "provenance_summary": "Presented as part of the Harry Leary Collection; acquisition detail was not supplied in this source package.",
  "qualifications": [
    "The HL TURBO 4 marking and visible damage are present in the supplied image.",
    "“The Last HLT4” is a collection attribution; production documentation was not supplied with this release."
  ],
  "people": [
    "Harry Leary"
  ],
  "organizations": [
    "Daylight"
  ],
  "subjects": [
    "bicycle frame",
    "HLT4",
    "HL Turbo 4",
    "damage"
  ],
  "related_records": [
    "26.0038",
    "26.0045",
    "26.0046"
  ],
  "cross_collection": null,
  "release_version": "1.0.0",
  "updated": "2026-07-23"
}
