{
  "$schema": "../../schema/harrys-room-record.schema.json",
  "record_id": "HLR-26.0021",
  "artifact_id": "26.0021",
  "legacy_ids": [],
  "title": "Harry Leary Thrill ROC 1 Jersey",
  "alternate_titles": [],
  "slug": "26-0021-harry-leary-thrill-roc-1-jersey",
  "collection": "Harry’s Room — The Harry Leary Collection",
  "room_zone": {
    "id": "riders-wardrobe",
    "label": "The Rider’s Wardrobe"
  },
  "record_type": "jersey",
  "holding_status": "current-holding-as-presented",
  "image_status": "direct",
  "primary_image": "../../source/artifact-images/26-0021-harry-leary-thrill-roc-1-jersey.png",
  "secondary_images": [],
  "source_pages": [
    {
      "source_label": "Original LititzBMX.com collection source 1",
      "url": "https://sites.google.com/view/lititzbmxinventorylist/collections/the-harry-leary-collection-1"
    }
  ],
  "claim_status": "source-supported",
  "description": "An orange, black and white Thrill jersey marked “LEARY,” “ROC” and number 1. It records rider identity, sponsor relationships and Race of Champions recognition in one object.",
  "provenance_summary": "From the Leary Locker, as documented in the Digital Jersey Wall record.",
  "qualifications": [
    "The rider name, ROC designation, number and sponsor marks are visible in the supplied image."
  ],
  "people": [
    "Harry Leary"
  ],
  "organizations": [
    "Thrill",
    "Box Components"
  ],
  "subjects": [
    "jersey",
    "ROC 1",
    "Race of Champions",
    "Leary Locker"
  ],
  "related_records": [
    "26.0023",
    "26.0018",
    "26.0075"
  ],
  "cross_collection": {
    "label": "Digital Jersey Wall",
    "path": "../../../jersey-collection/records/26-0021-leary-thrill-roc-1-jersey/"
  },
  "release_version": "1.0.0",
  "updated": "2026-07-23"
}
